{"schemaVersion":"1.0","requestId":"018f0000-0000-7000-8000-000000000001","caller":{"name":"test","sessionId":"sess-1"},"purpose":"test submit command","operation":"project-check-in","target":"projects/example/STATE.md","payload":{"currentState":"done","nextAction":"ship","summary":"test"},"submittedAt":"","expectedTargetHash":"abcd1234abcd1234abcd1234abcd1234abcd1234abcd1234abcd1234abcd1234","createOnly":false,"approvalReference":null}